{
  "$schema": "https://json-schema.org/draft/2020-12/schema",
  "$id": "https://hewn.tools/spec/2/capability.schema.json",
  "title": "Hewn capability manifest (capability.json), ABI 2",
  "type": "object",
  "required": [
    "id",
    "name",
    "purpose",
    "operations"
  ],
  "properties": {
    "id": {
      "type": "string",
      "pattern": "^[a-z0-9][a-z0-9-]*$"
    },
    "name": {
      "type": "string",
      "minLength": 1
    },
    "purpose": {
      "type": "string",
      "minLength": 1
    },
    "description": {
      "type": "string"
    },
    "abi": {
      "type": "string",
      "pattern": "^[0-9]+\\.[0-9]+$"
    },
    "kind": {
      "enum": [
        "capability",
        "connection"
      ]
    },
    "config": {
      "type": "array",
      "items": {
        "type": "object",
        "required": [
          "name",
          "description"
        ],
        "additionalProperties": false,
        "properties": {
          "name": {
            "type": "string",
            "pattern": "^[A-Z][A-Z0-9_]*$"
          },
          "description": {
            "type": "string",
            "minLength": 1
          }
        }
      }
    },
    "runtime": {
      "enum": [
        "isolate"
      ]
    },
    "hue": {
      "type": "integer",
      "minimum": 0,
      "maximum": 359
    },
    "requires": {
      "type": "object",
      "additionalProperties": false,
      "properties": {
        "secrets": {
          "type": "array",
          "items": {
            "type": "object",
            "required": [
              "name",
              "description"
            ],
            "properties": {
              "name": {
                "type": "string",
                "pattern": "^[A-Z][A-Z0-9_]*$"
              },
              "description": {
                "type": "string"
              }
            }
          }
        },
        "hosts": {
          "type": "array",
          "items": {
            "type": "string",
            "pattern": "^((\\*\\.)?[a-z0-9.-]+|config:[A-Z][A-Z0-9_]*)$"
          }
        },
        "model": {
          "type": "object",
          "additionalProperties": false,
          "properties": {
            "tier": {
              "enum": [
                "light",
                "standard",
                "strong",
                "max"
              ]
            },
            "model": {
              "type": "string",
              "pattern": "^(anthropic|openai|openrouter)/[A-Za-z0-9._:-]+(/[A-Za-z0-9._:-]+)?$"
            },
            "input": {
              "type": "array",
              "uniqueItems": true,
              "items": {
                "enum": [
                  "text",
                  "image"
                ]
              }
            }
          }
        },
        "capabilities": {
          "type": "array",
          "items": {
            "type": "object",
            "required": [
              "id",
              "operations"
            ],
            "additionalProperties": false,
            "properties": {
              "id": {
                "type": "string",
                "pattern": "^[a-z0-9][a-z0-9-]*$"
              },
              "operations": {
                "type": "array",
                "minItems": 1,
                "items": {
                  "type": "string",
                  "pattern": "^[a-z][a-z0-9_]*@[0-9]+$"
                }
              }
            }
          }
        }
      }
    },
    "tags": {
      "type": "array",
      "items": {
        "type": "string"
      }
    },
    "ui": {
      "type": "object",
      "properties": {
        "available": {
          "type": "boolean"
        }
      }
    },
    "widgets": {
      "type": "array",
      "maxItems": 8,
      "items": {
        "type": "object",
        "required": [
          "name",
          "version",
          "title",
          "operation",
          "sizes"
        ],
        "additionalProperties": false,
        "properties": {
          "name": {
            "type": "string",
            "pattern": "^[a-z][a-z0-9_]*$"
          },
          "version": {
            "type": "integer",
            "minimum": 1
          },
          "title": {
            "type": "string",
            "minLength": 1,
            "maxLength": 40
          },
          "description": {
            "type": "string",
            "maxLength": 200
          },
          "operation": {
            "type": "string",
            "pattern": "^[a-z][a-z0-9_]*@[0-9]+$"
          },
          "sizes": {
            "type": "array",
            "minItems": 1,
            "uniqueItems": true,
            "items": {
              "enum": [
                "small",
                "medium",
                "large"
              ]
            }
          },
          "refresh": {
            "type": "object",
            "additionalProperties": false,
            "properties": {
              "every": {
                "type": "string",
                "pattern": "^[0-9]+(m|h)$"
              }
            }
          },
          "open": {
            "type": "string",
            "pattern": "^ui(#[A-Za-z0-9_-]+)?$"
          }
        }
      }
    },
    "operations": {
      "type": "array",
      "minItems": 1,
      "items": {
        "type": "object",
        "required": [
          "name",
          "description",
          "version",
          "inputSchema",
          "outputSchema",
          "sideEffect"
        ],
        "properties": {
          "name": {
            "type": "string",
            "pattern": "^[a-z][a-z0-9_]*$"
          },
          "description": {
            "type": "string",
            "minLength": 1
          },
          "version": {
            "type": "integer",
            "minimum": 1
          },
          "inputSchema": {
            "type": "object"
          },
          "outputSchema": {
            "type": "object"
          },
          "sideEffect": {
            "enum": [
              "read",
              "write",
              "destructive"
            ]
          },
          "deprecated": {
            "type": "object",
            "additionalProperties": false,
            "properties": {
              "replacement": {
                "type": "string",
                "pattern": "^([a-z0-9][a-z0-9-]*/)?[a-z][a-z0-9_]*@[0-9]+$"
              },
              "note": {
                "type": "string",
                "maxLength": 500
              }
            }
          }
        }
      }
    }
  }
}
